Pillar ID,Pillar Name,Maturity Level,Target Maturity,Linked NIST 800-171 Controls,Linked SOC2 Controls,Sentinel Automation,Key Evidence,Gaps / Next Steps
ZT-01,User,Intermediate,Advanced,"3.1.1; 3.1.5; 3.5.1; 3.5.2; 3.5.3",CC6.1; CC6.2; CC6.3,iam_access_review; config_drift,Quarterly IAM review + MFA enforcement report,Deploy hardware MFA for break-glass admins; integrate IdP conditional access export
ZT-02,Device,Basic,Intermediate,"3.1.18; 3.1.19; 3.4.2",CC6.2,config_drift (partial),MDM enrollment policy; endpoint encryption checklist,No automated MDM posture collector in Sentinel v1.6; add Intune/Jamf integration
ZT-03,Network / Environment,Intermediate,Advanced,"3.13.1; 3.13.5; 3.13.6; 3.13.8",C1.3; CC7.1,config_drift; log_aggregator,VPC flow logs + security group drift + TLS audit,Micro-segmentation documentation incomplete; ZTNA rollout planned Q3 2026
ZT-04,Application and Workload,Intermediate,Advanced,"3.4.1; 3.4.3; 3.13.2; 3.13.3",CC8.1,config_drift,Infrastructure-as-code baselines + change drift alerts,CAB ticket linkage to deployments not automated
ZT-05,Data,Advanced,Advanced,"3.1.3; 3.8.9; 3.13.8; 3.13.16",C1.1; C1.2; C1.4,encryption_status; retention_check,Encryption-at-rest scan + lifecycle policy validation,DLP and data flow mapping for CUI boundaries remain manual
ZT-06,Visibility and Analytics,Intermediate,Advanced,"3.3.1; 3.3.5; 3.14.6; 3.14.7",CC7.1; CC7.2,log_aggregator; self_assessment_report,Log completeness metrics + monthly self-assessment score,SIEM use-case library and UEBA not yet deployed
ZT-07,Automation and Orchestration,Intermediate,Advanced,"3.12.1; 3.12.3; 3.6.1",CC7.2; CC8.1,self_assessment_report; run-all CLI,Automated evidence collection pipeline + POA&M feed,SOAR playbooks for auto-remediation of drift findings on roadmap